name,environment,source_ip,source_zone_code,server_code,port_number,destination_zone_code,protocol,action,status,notes
ALLOW_INTERNET_HTTP_LB,PROD,,INTERNET,SRV-PROD-LB-001,80,DMZ_PROD,HTTP,ALLOW,ACTIVE,Allow HTTP từ internet vào Load Balancer (redirect to HTTPS)
ALLOW_INTERNET_HTTPS_PAY,PROD,,INTERNET,SRV-PROD-GW-001,443,DMZ_PROD,HTTPS,ALLOW,ACTIVE,Allow HTTPS từ internet trực tiếp đến Payment Gateway
ALLOW_LB_TO_NGINX,PROD,192.168.10.41,DMZ_PROD,SRV-PROD-GW-001,80,DMZ_PROD,HTTP,ALLOW,ACTIVE,HAProxy phân phối HTTP traffic vào NGINX API Gateway
ALLOW_LB_TO_PAY_GW,PROD,192.168.10.41,DMZ_PROD,SRV-PROD-GW-001,443,DMZ_PROD,HTTPS,ALLOW,ACTIVE,HAProxy định tuyến HTTPS đến Payment Gateway
ALLOW_NGINX_TO_IB_PORTAL,PROD,192.168.10.31,DMZ_PROD,SRV-PROD-APP-001,3000,APP_PROD,HTTP,ALLOW,ACTIVE,NGINX reverse proxy đến Internet Banking Portal
ALLOW_NGINX_TO_ADMIN,PROD,192.168.10.31,DMZ_PROD,SRV-PROD-APP-001,9090,APP_PROD,HTTP,ALLOW,ACTIVE,NGINX reverse proxy đến Admin Portal (internal network only)
ALLOW_IB_PORTAL_TO_IB_API,PROD,192.168.10.11,APP_PROD,SRV-PROD-APP-002,8085,APP_PROD,HTTP,ALLOW,ACTIVE,IB Portal gọi IB API để lấy dữ liệu nghiệp vụ tài khoản
ALLOW_IB_API_TO_CBS,PROD,192.168.10.12,APP_PROD,SRV-PROD-APP-001,8080,APP_PROD,HTTP,ALLOW,ACTIVE,IB API truy vấn tài khoản và khách hàng từ Core Banking
ALLOW_IB_API_TO_CBS_GRPC,PROD,192.168.10.12,APP_PROD,SRV-PROD-APP-002,9093,APP_PROD,GRPC,ALLOW,ACTIVE,IB API thực hiện giao dịch qua gRPC Transaction Engine
ALLOW_IB_AUTH_TO_REDIS,PROD,192.168.10.11,APP_PROD,SRV-PROD-CACHE-001,6379,INFRA_PROD,TCP,ALLOW,ACTIVE,IB Auth Service lưu và tra cứu session token qua Redis
ALLOW_MB_TO_IB_API,PROD,192.168.10.71,APP_PROD,SRV-PROD-APP-002,8085,APP_PROD,HTTP,ALLOW,ACTIVE,Mobile Banking gọi IB API lấy dữ liệu tài khoản
ALLOW_MB_TO_IB_AUTH,PROD,192.168.10.71,APP_PROD,SRV-PROD-APP-001,8090,APP_PROD,HTTP,ALLOW,ACTIVE,Mobile Banking xác thực người dùng qua Auth Service
ALLOW_MB_TO_POSTGRES_MB,PROD,192.168.10.71,APP_PROD,SRV-PROD-DB-003,5432,DB_PROD,TCP,ALLOW,ACTIVE,Mobile Banking lưu dữ liệu thiết bị và preference vào DB riêng
ALLOW_PAY_GW_TO_CBS,PROD,192.168.10.31,DMZ_PROD,SRV-PROD-APP-001,8080,APP_PROD,HTTP,ALLOW,ACTIVE,Payment Gateway kiểm tra số dư tài khoản nguồn qua Core Banking
ALLOW_PAY_GW_TO_ACCT,PROD,192.168.10.31,DMZ_PROD,SRV-PROD-APP-001,8081,APP_PROD,HTTP,ALLOW,ACTIVE,Payment Gateway tra cứu thông tin tài khoản chi tiết
ALLOW_PAY_SWITCH_TO_PAY_GW,PROD,192.168.10.12,APP_PROD,SRV-PROD-GW-001,443,DMZ_PROD,HTTPS,ALLOW,ACTIVE,Payment Switch định tuyến giao dịch liên ngân hàng qua Payment Gateway
ALLOW_CBS_TO_TRAN_GRPC,PROD,192.168.10.11,APP_PROD,SRV-PROD-APP-002,9093,APP_PROD,GRPC,ALLOW,ACTIVE,Core Banking gọi Transaction Engine xử lý nghiệp vụ giao dịch
ALLOW_CBS_TO_DB,PROD,192.168.10.11,APP_PROD,SRV-PROD-DB-001,5432,DB_PROD,TCP,ALLOW,ACTIVE,Core Banking kết nối cơ sở dữ liệu nghiệp vụ chính (PostgreSQL Core)
ALLOW_CBS_TO_REDIS,PROD,192.168.10.11,APP_PROD,SRV-PROD-CACHE-001,6379,INFRA_PROD,TCP,ALLOW,ACTIVE,Core Banking cache tra cứu khách hàng và tỷ giá qua Redis
ALLOW_CBS_TO_ACCT,PROD,192.168.10.11,APP_PROD,SRV-PROD-APP-001,8081,APP_PROD,HTTP,ALLOW,ACTIVE,Core Banking đồng bộ trạng thái và số dư tài khoản
ALLOW_TRAN_TO_DB,PROD,192.168.10.12,APP_PROD,SRV-PROD-DB-001,5432,DB_PROD,TCP,ALLOW,ACTIVE,Transaction Engine ghi nhận log giao dịch vào DB
ALLOW_TRAN_TO_MQ,PROD,192.168.10.12,APP_PROD,SRV-PROD-MQ-001,5672,INFRA_PROD,AMQP,ALLOW,ACTIVE,Transaction Engine publish sự kiện giao dịch để audit
ALLOW_LOAN_TO_CBS,PROD,192.168.10.12,APP_PROD,SRV-PROD-APP-001,8080,APP_PROD,HTTP,ALLOW,ACTIVE,Loan Management truy vấn thông tin khách hàng từ Core Banking
ALLOW_LOAN_TO_ACCT,PROD,192.168.10.12,APP_PROD,SRV-PROD-APP-001,8081,APP_PROD,HTTP,ALLOW,ACTIVE,Loan Management kiểm tra tài khoản cho vay
ALLOW_PAY_SETTLE_TO_MQ,PROD,192.168.10.11,APP_PROD,SRV-PROD-MQ-001,5672,INFRA_PROD,AMQP,ALLOW,ACTIVE,Settlement Service publish sự kiện hoàn tất quyết toán
ALLOW_AUDIT_TO_CBS,PROD,192.168.10.12,APP_PROD,SRV-PROD-APP-001,8080,APP_PROD,HTTP,ALLOW,ACTIVE,Audit Service theo dõi thao tác nghiệp vụ trên Core Banking
ALLOW_AUDIT_TO_MQ,PROD,192.168.10.12,APP_PROD,SRV-PROD-MQ-001,5672,INFRA_PROD,AMQP,ALLOW,ACTIVE,Audit Service subscribe sự kiện từ Message Queue để ghi log
ALLOW_DBA_TO_DB_PROD,PROD,10.200.0.0/24,,,5432,DB_PROD,TCP,ALLOW,ACTIVE,DBA Team (management network 10.200.0.x) truy cập DB để bảo trì
DENY_INTERNET_TO_CBS,PROD,,INTERNET,SRV-PROD-APP-001,8080,APP_PROD,HTTP,DENY,ACTIVE,Chặn truy cập trực tiếp từ internet vào Core Banking API
DENY_INTERNET_TO_DB,PROD,,INTERNET,SRV-PROD-DB-001,5432,DB_PROD,TCP,DENY,ACTIVE,Chặn mọi truy cập từ internet vào cơ sở dữ liệu
DENY_DEV_TO_PROD_DB,PROD,192.168.40.0/24,,SRV-PROD-DB-001,5432,DB_PROD,TCP,DENY,ACTIVE,Cấm mạng DEV truy cập database PROD để tránh rủi ro dữ liệu
DENY_UAT_TO_PROD_DB,PROD,192.168.30.0/24,,SRV-PROD-DB-001,5432,DB_PROD,TCP,DENY,ACTIVE,Cấm mạng UAT truy cập database PROD để đảm bảo cách ly môi trường
ALLOW_ANALYTICS_TO_DB_RO,PROD,10.100.5.50,,SRV-PROD-DB-001,5432,DB_PROD,TCP,ALLOW,PENDING_APPROVAL,Yêu cầu cấp quyền đọc readonly cho BI analytics tool (10.100.5.50)
ALLOW_EXT_PARTNER_FINTECH,PROD,203.113.44.100,,SRV-PROD-GW-001,443,DMZ_PROD,HTTPS,ALLOW,PENDING_APPROVAL,Đối tác fintech yêu cầu truy cập Payment API cho tích hợp thanh toán
ALLOW_MONITORING_PROMETHEUS,PROD,10.200.0.10,,SRV-PROD-APP-001,9090,APP_PROD,HTTP,ALLOW,INACTIVE,Prometheus scrape metrics từ Admin Portal (disabled — đang cấu hình lại)
DENY_LEGACY_SYSTEM,PROD,10.50.1.0/24,,SRV-PROD-APP-001,8080,APP_PROD,HTTP,DENY,REJECTED,Hệ thống legacy yêu cầu kết nối trực tiếp CBS — từ chối vì phải qua API gateway
ALLOW_NGINX_TO_IB_PORTAL,UAT,192.168.30.31,DMZ_UAT,SRV-UAT-APP-001,3000,APP_UAT,HTTP,ALLOW,ACTIVE,NGINX gateway UAT proxy đến IB Portal
ALLOW_IB_PORTAL_TO_IB_API,UAT,192.168.30.11,APP_UAT,SRV-UAT-APP-001,8085,APP_UAT,HTTP,ALLOW,ACTIVE,IB Portal gọi IB API (UAT)
ALLOW_IB_API_TO_CBS,UAT,192.168.30.11,APP_UAT,SRV-UAT-APP-001,8080,APP_UAT,HTTP,ALLOW,ACTIVE,IB API truy vấn Core Banking (UAT)
ALLOW_IB_API_TO_TRAN_GRPC,UAT,192.168.30.11,APP_UAT,SRV-UAT-APP-001,9093,APP_UAT,GRPC,ALLOW,ACTIVE,IB API gọi Transaction Engine gRPC (UAT)
ALLOW_IB_AUTH_TO_REDIS,UAT,192.168.30.11,APP_UAT,SRV-UAT-APP-001,6379,APP_UAT,TCP,ALLOW,ACTIVE,Auth Service lưu session Redis (UAT — Redis trên cùng server)
ALLOW_MB_TO_IB_API,UAT,192.168.30.11,APP_UAT,SRV-UAT-APP-001,8085,APP_UAT,HTTP,ALLOW,ACTIVE,Mobile Banking gọi IB API (UAT)
ALLOW_PAY_GW_TO_CBS,UAT,192.168.30.31,DMZ_UAT,SRV-UAT-APP-001,8080,APP_UAT,HTTP,ALLOW,ACTIVE,Payment Gateway kiểm tra Core Banking (UAT)
ALLOW_CBS_TO_DB,UAT,192.168.30.11,APP_UAT,SRV-UAT-DB-001,5432,DB_UAT,TCP,ALLOW,ACTIVE,Core Banking kết nối PostgreSQL UAT
ALLOW_TESTER_TO_CBS,UAT,10.200.0.0/24,,SRV-UAT-APP-001,8080,APP_UAT,HTTP,ALLOW,ACTIVE,Nhóm kiểm thử (management network) truy cập trực tiếp CBS API (UAT)
ALLOW_TESTER_TO_DB,UAT,10.200.0.0/24,,SRV-UAT-DB-001,5432,DB_UAT,TCP,ALLOW,ACTIVE,DBA và kiểm thử viên truy cập DB UAT để chuẩn bị dữ liệu test
DENY_INTERNET_TO_UAT,UAT,,INTERNET,SRV-UAT-APP-001,8080,APP_UAT,HTTP,DENY,ACTIVE,Cấm internet truy cập thẳng vào UAT — chỉ cho phép từ nội bộ
ALLOW_IB_API_TO_CBS_DEV,DEV,192.168.40.11,APP_DEV,SRV-DEV-APP-001,8080,APP_DEV,HTTP,ALLOW,ACTIVE,IB API truy vấn Core Banking (DEV)
ALLOW_IB_API_TO_TRAN_GRPC_DEV,DEV,192.168.40.11,APP_DEV,SRV-DEV-APP-002,9093,APP_DEV,GRPC,ALLOW,ACTIVE,IB API gọi Transaction Engine gRPC (DEV)
ALLOW_MB_TO_IB_API_DEV,DEV,192.168.40.12,APP_DEV,SRV-DEV-APP-001,8085,APP_DEV,HTTP,ALLOW,ACTIVE,Mobile Banking gọi IB API (DEV)
ALLOW_PAY_GW_TO_CBS_DEV,DEV,192.168.40.12,APP_DEV,SRV-DEV-APP-001,8080,APP_DEV,HTTP,ALLOW,ACTIVE,Payment Gateway kiểm tra Core Banking (DEV)
ALLOW_CBS_TO_DB_DEV,DEV,192.168.40.11,APP_DEV,SRV-DEV-DB-001,5432,DB_DEV,TCP,ALLOW,ACTIVE,Core Banking kết nối PostgreSQL DEV
ALLOW_CBS_TO_REDIS_DEV,DEV,192.168.40.11,APP_DEV,SRV-DEV-CACHE-001,6379,INFRA_DEV,TCP,ALLOW,ACTIVE,Core Banking cache Redis DEV
ALLOW_CBS_TO_ELASTIC_DEV,DEV,192.168.40.11,APP_DEV,SRV-DEV-APP-001,9200,APP_DEV,HTTP,ALLOW,ACTIVE,Core Banking index dữ liệu tìm kiếm khách hàng (Elasticsearch DEV)
ALLOW_TRAN_TO_MQ_DEV,DEV,192.168.40.12,APP_DEV,SRV-DEV-APP-002,5672,APP_DEV,AMQP,ALLOW,ACTIVE,Transaction Engine publish sự kiện (DEV — RabbitMQ trên APP-002)
ALLOW_DEV_TEAM_TO_DB_DEV,DEV,192.168.40.0/24,,SRV-DEV-DB-001,5432,DB_DEV,TCP,ALLOW,ACTIVE,Toàn bộ mạng DEV có quyền truy cập DB DEV cho phát triển
DENY_DEV_TO_UAT_DB,DEV,192.168.40.0/24,,SRV-UAT-DB-001,5432,DB_UAT,TCP,DENY,ACTIVE,Cấm mạng DEV truy cập DB UAT để tránh làm bẩn dữ liệu kiểm thử
